section,include,title,institution,loc,start,end,description_1,description_2,description_3,description_4,description_5
education,TRUE,BS. Mathematics & Statistics (Double Major),Florida State University,"Tallahassee, FL",2002,2006,NA,NA,NA,NA,NA
education,TRUE,MS. Mathematics,Florida State University,"Tallahassee, FL",2006,2009,NA,NA,NA,NA,NA
education,TRUE,PhD. Mathematics,Florida State University,"Tallahassee, FL",2009,2012,NA,NA,NA,NA,NA
work,TRUE,Senior Biostatistician,Premier Research Group,"Philadelphia, PA",2012,2014,Leads a team of data scientists and data engineers building pilot solutions and conducting experimental design at a Fortune 500 specialty insurance company,"Leverages test-and-learn methodology, delivering pilot solutions quickly to small groups to measure value before scaling products",Prioritizes work based on customer engagement to understand pain-points and identify data-enabled solutions to suit business needs,"Uses Azure DevOps for the continuous deployment of applications to production environments, experienced with establishing and maintaining VMs in Azure","Remains a hands-on developer, regularly using R, Python, Git, Databricks, etc."
work,TRUE,"Senior Research Analyst, Advanced Analytics & Data Science  ",Independence Blue Cross,"Philadelphia, PA",2014,2016,Associate Data Scientist (2018-2020)  -  Data Scientist (2020-2021),Data science developer on an agile sprint team managing applications that prioritize and monitor incoming business submissions,"Develops, maintains, and deploys machine learning models, primarily GLMs, decision trees, and dabbling in unsupervised techniques","Conducts ad hoc analysis to diagnosis trends, analyze model performance, and make business recommendations based on data and statistical tests","Co-chairman of  the Markel Veteran's Network, an Employee Resource Group (2020)"
work,TRUE,"Research Scientist, Advanced Analytics & Data Science  ",Independence Blue Cross,"Philadelphia, PA",2016,2018,"Advisor to the commissioner and senior executives of an 1,800-person organization, representing the commissioner at the state legislature and senior-level meetings",Communicated agency policies to the General Assembly and Military installations,NA,NA,NA
work,TRUE,"Senior Research Scientist, Advanced Analytics & Data Science  ",Independence Blue Cross,"Philadelphia, PA",2018,2022,"Served in a variety of journalism and public relations roles with the 82nd Airborne Division, U.S. Military Academy and a Special Forces unit, including two deployments to Afghanistan","Managed small, technical teams supporting high-risk training and deployments ",Named Distinguished Honor Graduate and Distinguished Leader Graduate during two Army leadership training courses,NA,NA
awards,TRUE,Business School Alumni Award,Virginia Commonwealth University,"Richmond, VA",2019,NA,Given Distinguished Alumni Award for starting an alumni meetup group to share data science trends and best practices,NA,NA,NA,NA
